{
  "schema_version": 1,
  "type": "pystg.pattern",
  "id": "c534b8c2-e0ef-5a70-aa7f-94fa6edf6a88",
  "name": "月轮八重奏",
  "metadata": {
    "description": "第一阶段：缓慢旋转的蓝色花形月轮。",
    "example": "mist_lake_boss",
    "phase": 1
  },
  "symbol_name": "moon_ring_octet",
  "seed": 2026082101,
  "bullet": {
    "bullet_type": "star_s",
    "color": "blue",
    "resource": null
  },
  "shape": {
    "kind": "flower",
    "count": 20,
    "origin_x": 0.0,
    "origin_y": 0.58,
    "angle_span": 360.0,
    "line_length": 1.0,
    "line_angle": 0.0
  },
  "aim": {
    "mode": "fixed",
    "angle": 270.0
  },
  "schedule": {
    "delay_frames": 0,
    "interval_frames": 18,
    "burst_count": 10,
    "loop_count": null
  },
  "motion": {
    "speed": 1.75,
    "friction": 0.0,
    "spin": 0.25,
    "time_scale": 1.0,
    "max_lifetime": 6.0,
    "render_scale": 1.0,
    "bounce_x": false,
    "bounce_y": false
  },
  "modifiers": {
    "angle_offset_per_burst": 9.0,
    "speed_offset_per_burst": 0.04,
    "random_speed_variation": 0.0
  },
  "bindings": [],
  "graph": null,
  "script": null
}
