{
  "schema_version": 1,
  "type": "pystg.pattern",
  "id": "bddba5d5-94da-4b3f-9f22-fa0302429a96",
  "name": "Pattern V1 Fixture",
  "metadata": {},
  "seed": 0,
  "bullet": {
    "bullet_type": "ball_m",
    "color": "red",
    "resource": null
  },
  "shape": {
    "kind": "ring",
    "count": 24,
    "origin_x": 0.0,
    "origin_y": 0.65,
    "angle_span": 360.0,
    "line_length": 1.0,
    "line_angle": 0.0
  },
  "aim": {
    "mode": "fixed",
    "angle": 270.0
  },
  "schedule": {
    "delay_frames": 0,
    "interval_frames": 20,
    "burst_count": 1,
    "loop_count": 1
  },
  "motion": {
    "speed": 2.0,
    "friction": 0.0,
    "spin": 0.0,
    "time_scale": 1.0,
    "max_lifetime": 0.0,
    "render_scale": 1.0,
    "bounce_x": false,
    "bounce_y": false
  },
  "modifiers": {
    "angle_offset_per_burst": 0.0,
    "speed_offset_per_burst": 0.0,
    "random_speed_variation": 0.0
  },
  "bindings": [],
  "graph": null,
  "script": null
}