{
  "schema_version": 1,
  "type": "pystg.pattern",
  "id": "3bbc5efe-6b11-5774-b1fd-534981358dda",
  "name": "紫潮追猎",
  "metadata": {
    "description": "第二阶段：朝向玩家的高速紫色扇形刀弹。",
    "example": "mist_lake_boss",
    "phase": 2
  },
  "symbol_name": "purple_tide_hunt",
  "seed": 2026082102,
  "bullet": {
    "bullet_type": "knife",
    "color": "purple",
    "resource": null
  },
  "shape": {
    "kind": "arc",
    "count": 17,
    "origin_x": 0.0,
    "origin_y": 0.58,
    "angle_span": 132.0,
    "line_length": 1.0,
    "line_angle": 0.0
  },
  "aim": {
    "mode": "player",
    "angle": 270.0
  },
  "schedule": {
    "delay_frames": 0,
    "interval_frames": 9,
    "burst_count": 18,
    "loop_count": null
  },
  "motion": {
    "speed": 2.35,
    "friction": 0.0,
    "spin": 0.0,
    "time_scale": 1.0,
    "max_lifetime": 5.5,
    "render_scale": 1.0,
    "bounce_x": false,
    "bounce_y": false
  },
  "modifiers": {
    "angle_offset_per_burst": 5.0,
    "speed_offset_per_burst": 0.025,
    "random_speed_variation": 0.08
  },
  "bindings": [],
  "graph": null,
  "script": null
}
