{
  "schema_version": 1,
  "type": "pystg.pattern",
  "id": "11000000-0000-4000-8000-000000000001",
  "name": "练习 1：第一圈星弹",
  "metadata": {
    "description": "最简单的入门 Pattern：只观察数量、速度和间隔。",
    "tutorial_level": 1,
    "script_required": false
  },
  "symbol_name": "beginner_first_ring",
  "seed": 2026082301,
  "bullet": {
    "bullet_type": "star_s",
    "color": "blue",
    "resource": null
  },
  "shape": {
    "kind": "ring",
    "count": 16,
    "origin_x": 0.0,
    "origin_y": 0.62,
    "angle_span": 360.0,
    "line_length": 1.0,
    "line_angle": 0.0
  },
  "aim": {
    "mode": "fixed",
    "angle": 270.0
  },
  "schedule": {
    "delay_frames": 0,
    "interval_frames": 24,
    "burst_count": 8,
    "loop_count": null
  },
  "motion": {
    "speed": 1.4,
    "friction": 0.0,
    "spin": 0.0,
    "time_scale": 1.0,
    "max_lifetime": 6.0,
    "render_scale": 1.0,
    "bounce_x": false,
    "bounce_y": false
  },
  "modifiers": {
    "angle_offset_per_burst": 0.0,
    "speed_offset_per_burst": 0.0,
    "random_speed_variation": 0.0
  },
  "bindings": [],
  "graph": null,
  "script": null
}
